{
  "audit_id": "sample-platform-first-workflow",
  "created_at": "2026-08-20T00:00:00Z",
  "punchlist_version": "0.1.0",
  "taxonomy_version": "0.1.0",
  "schema_version": "1.0",
  "brief": {
    "user": "A first-time evaluator",
    "task": "Compare options before starting a core workflow.",
    "entry_point": "Synthetic evaluation start page",
    "state": "First visit",
    "device": "Desktop",
    "profile": "experience",
    "severity_basis": "Ability to choose an option with confidence"
  },
  "target": {
    "classification": "synthetic"
  },
  "provenance": [
    {
      "provenance_id": "prov-synthetic-surface",
      "classification": "synthetic",
      "source": "Synthetic Sample Platform fixture",
      "summary": "Invented Sample Platform evidence.",
      "publication_approved": true
    }
  ],
  "capabilities": {
    "rendered_surface_proven_live": true,
    "supported_inputs": [
      "rendered"
    ]
  },
  "critics": [
    {
      "critic_id": "synthetic-critic",
      "ledger_ids": [
        "ledger-01",
        "ledger-02",
        "ledger-04",
        "ledger-05",
        "ledger-07",
        "ledger-08",
        "ledger-11",
        "ledger-12",
        "ledger-13",
        "ledger-17",
        "ledger-21",
        "ledger-23",
        "ledger-24",
        "ledger-25",
        "ledger-26",
        "ledger-27",
        "ledger-28",
        "ledger-30",
        "ledger-31",
        "ledger-33",
        "ledger-35"
      ]
    }
  ],
  "ledger": [
    {
      "ledger_id": "ledger-01",
      "defect": "state-babel",
      "disposition": "checked_absent",
      "eligibility_evidence": "The proven-live synthetic surface supports a rendered visual check.",
      "probe": "Synthetic evaluator check.",
      "closure_evidence": "A synthetic rendered probe closed this eligible check."
    },
    {
      "ledger_id": "ledger-02",
      "defect": "double-booked-signal",
      "disposition": "checked_absent",
      "eligibility_evidence": "The proven-live synthetic surface supports a rendered visual check.",
      "probe": "Synthetic evaluator check.",
      "closure_evidence": "A synthetic rendered probe closed this eligible check."
    },
    {
      "ledger_id": "ledger-04",
      "defect": "weight-whiplash",
      "disposition": "checked_absent",
      "eligibility_evidence": "The proven-live synthetic surface supports a rendered visual check.",
      "probe": "Synthetic evaluator check.",
      "closure_evidence": "A synthetic rendered probe closed this eligible check."
    },
    {
      "ledger_id": "ledger-05",
      "defect": "order-drift",
      "disposition": "checked_absent",
      "eligibility_evidence": "The proven-live synthetic surface supports a rendered visual check.",
      "probe": "Synthetic evaluator check.",
      "closure_evidence": "A synthetic rendered probe closed this eligible check."
    },
    {
      "ledger_id": "ledger-07",
      "defect": "long-distance-label",
      "disposition": "checked_absent",
      "eligibility_evidence": "The proven-live synthetic surface supports a rendered visual check.",
      "probe": "Synthetic evaluator check.",
      "closure_evidence": "A synthetic rendered probe closed this eligible check."
    },
    {
      "ledger_id": "ledger-08",
      "defect": "marathon-measure",
      "disposition": "checked_absent",
      "eligibility_evidence": "The proven-live synthetic surface supports a rendered visual check.",
      "probe": "Synthetic evaluator check.",
      "closure_evidence": "A synthetic rendered probe closed this eligible check."
    },
    {
      "ledger_id": "ledger-11",
      "defect": "sub-floor-target",
      "disposition": "checked_absent",
      "eligibility_evidence": "The proven-live synthetic surface supports a rendered visual check.",
      "probe": "Synthetic evaluator check.",
      "closure_evidence": "A synthetic rendered probe closed this eligible check."
    },
    {
      "ledger_id": "ledger-12",
      "defect": "vanishing-ink",
      "disposition": "found",
      "eligibility_evidence": "The proven-live synthetic surface supports a rendered visual check.",
      "probe": "Synthetic rendered comparison.",
      "closure_evidence": "A synthetic rendered probe closed this eligible check."
    },
    {
      "ledger_id": "ledger-13",
      "defect": "tint-on-tint-trap",
      "disposition": "not_assessed",
      "eligibility_evidence": "The proven-live synthetic surface supports a rendered visual check.",
      "probe": "Compare the rendered foreground and background token values.",
      "closure_evidence": "The synthetic rendered probe omits the token values required to distinguish a tint relationship from a flat color.",
      "not_assessed_id": "na-tint-on-tint-trap"
    },
    {
      "ledger_id": "ledger-17",
      "defect": "recall-tax",
      "disposition": "found",
      "eligibility_evidence": "The proven-live synthetic surface supports a rendered visual check.",
      "probe": "Synthetic interaction check.",
      "closure_evidence": "A synthetic rendered probe closed this eligible check."
    },
    {
      "ledger_id": "ledger-21",
      "defect": "backstage-bleed",
      "disposition": "checked_absent",
      "eligibility_evidence": "The proven-live synthetic surface supports a rendered visual check.",
      "probe": "Synthetic evaluator check.",
      "closure_evidence": "A synthetic rendered probe closed this eligible check."
    },
    {
      "ledger_id": "ledger-23",
      "defect": "arithmetic-mirage",
      "disposition": "checked_absent",
      "eligibility_evidence": "The proven-live synthetic surface supports a rendered visual check.",
      "probe": "Synthetic evaluator check.",
      "closure_evidence": "A synthetic rendered probe closed this eligible check."
    },
    {
      "ledger_id": "ledger-24",
      "defect": "phantom-freshness",
      "disposition": "checked_absent",
      "eligibility_evidence": "The proven-live synthetic surface supports a rendered visual check.",
      "probe": "Synthetic evaluator check.",
      "closure_evidence": "A synthetic rendered probe closed this eligible check."
    },
    {
      "ledger_id": "ledger-25",
      "defect": "scolding-machine",
      "disposition": "checked_absent",
      "eligibility_evidence": "The proven-live synthetic surface supports a rendered visual check.",
      "probe": "Synthetic evaluator check.",
      "closure_evidence": "A synthetic rendered probe closed this eligible check."
    },
    {
      "ledger_id": "ledger-26",
      "defect": "foghorn-error",
      "disposition": "checked_absent",
      "eligibility_evidence": "The proven-live synthetic surface supports a rendered visual check.",
      "probe": "Synthetic evaluator check.",
      "closure_evidence": "A synthetic rendered probe closed this eligible check."
    },
    {
      "ledger_id": "ledger-27",
      "defect": "blindfold-link",
      "disposition": "checked_absent",
      "eligibility_evidence": "The proven-live synthetic surface supports a rendered visual check.",
      "probe": "Synthetic evaluator check.",
      "closure_evidence": "A synthetic rendered probe closed this eligible check."
    },
    {
      "ledger_id": "ledger-28",
      "defect": "blank-doorplate",
      "disposition": "checked_absent",
      "eligibility_evidence": "The proven-live synthetic surface supports a rendered visual check.",
      "probe": "Synthetic evaluator check.",
      "closure_evidence": "A synthetic rendered probe closed this eligible check."
    },
    {
      "ledger_id": "ledger-30",
      "defect": "corporate-fog",
      "disposition": "checked_absent",
      "eligibility_evidence": "The proven-live synthetic surface supports a rendered visual check.",
      "probe": "Synthetic evaluator check.",
      "closure_evidence": "A synthetic rendered probe closed this eligible check."
    },
    {
      "ledger_id": "ledger-31",
      "defect": "guessing-game-field",
      "disposition": "checked_absent",
      "eligibility_evidence": "The proven-live synthetic surface supports a rendered visual check.",
      "probe": "Synthetic evaluator check.",
      "closure_evidence": "A synthetic rendered probe closed this eligible check."
    },
    {
      "ledger_id": "ledger-33",
      "defect": "needless-census",
      "disposition": "checked_absent",
      "eligibility_evidence": "The proven-live synthetic surface supports a rendered visual check.",
      "probe": "Synthetic evaluator check.",
      "closure_evidence": "A synthetic rendered probe closed this eligible check."
    },
    {
      "ledger_id": "ledger-35",
      "defect": "patchwork-voice",
      "disposition": "checked_absent",
      "eligibility_evidence": "The proven-live synthetic surface supports a rendered visual check.",
      "probe": "Synthetic evaluator check.",
      "closure_evidence": "A synthetic rendered probe closed this eligible check."
    }
  ],
  "findings": [
    {
      "finding_id": "f-fc11114007df",
      "defect": "vanishing-ink",
      "surface": "decision screen",
      "locator": "primary comparison card",
      "fingerprint": "fc11114007df9a0d46fedb868288ef9820cba2f67d1526ed9b20bdde1e04fe25",
      "manifestation": "consistent",
      "symptom": "The option detail text is hard to distinguish from its card background.",
      "evidence": [
        {
          "type": "rendered",
          "provenance_id": "prov-synthetic-surface",
          "classification": "synthetic",
          "source": "synthetic rendered probe",
          "summary": "A rendered comparison probe confirms that the detail text remains visually indistinct from its card background.",
          "verified_how": "rendered",
          "publication_approved": true
        }
      ],
      "verified_how": "rendered",
      "severity_basis": "Ability to choose an option with confidence",
      "severity_votes": [
        {
          "critic_id": "synthetic-critic",
          "severity": 3
        }
      ],